_lab/logs/run3/edit5_flipset.json
{
  "results": [
    {
      "kernel": "jsd",
      "M": 8192,
      "N": 30522,
      "split": "train",
      "n_tiled": 2,
      "nro": 2,
      "itemsize": 4,
      "extent_np2": 32768,
      "old_cap": 4096,
      "new_cap": 2048,
      "old_rblock": 4096,
      "new_rblock": 2048,
      "emitted_rblock": 2048,
      "FLIP": true,
      "consistent": true,
      "num_warps": 32
    },
    {
      "kernel": "jsd",
      "M": 8192,
      "N": 32000,
      "split": "train",
      "n_tiled": 2,
      "nro": 2,
      "itemsize": 4,
      "extent_np2": 32768,
      "old_cap": 4096,
      "new_cap": 2048,
      "old_rblock": 4096,
      "new_rblock": 2048,
      "emitted_rblock": 2048,
      "FLIP": true,
      "consistent": true,
      "num_warps": 32
    },
    {
      "kernel": "jsd",
      "M": 8192,
      "N": 32064,
      "split": "train",
      "n_tiled": 2,
      "nro": 2,
      "itemsize": 4,
      "extent_np2": 32768,
      "old_cap": 4096,
      "new_cap": 2048,
      "old_rblock": 4096,
      "new_rblock": 2048,
      "emitted_rblock": 2048,
      "FLIP": true,
      "consistent": true,
      "num_warps": 32
    },
    {
      "kernel": "jsd",
      "M": 8192,
      "N": 50257,
      "split": "train",
      "n_tiled": 2,
      "nro": 2,
      "itemsize": 4,
      "extent_np2": 65536,
      "old_cap": 4096,
      "new_cap": 2048,
      "old_rblock": 4096,
      "new_rblock": 2048,
      "emitted_rblock": 2048,
      "FLIP": true,
      "consistent": true,
      "num_warps": 32
    },
    {
      "kernel": "jsd",
      "M": 8192,
      "N": 50304,
      "split": "train",
      "n_tiled": 2,
      "nro": 2,
      "itemsize": 4,
      "extent_np2": 65536,
      "old_cap": 4096,
      "new_cap": 2048,
      "old_rblock": 4096,
      "new_rblock": 2048,
      "emitted_rblock": 2048,
      "FLIP": true,
      "consistent": true,
      "num_warps": 32
    },
    {
      "kernel": "jsd",
      "M": 8192,
      "N": 65536,
      "split": "train",
      "n_tiled": 2,
      "nro": 2,
      "itemsize": 4,
      "extent_np2": 65536,
      "old_cap": 4096,
      "new_cap": 2048,
      "old_rblock": 4096,
      "new_rblock": 2048,
      "emitted_rblock": 2048,
      "FLIP": true,
      "consistent": true,
      "num_warps": 32
    },
    {
      "kernel": "jsd",
      "M": 4096,
      "N": 49152,
      "split": "train",
      "n_tiled": 2,
      "nro": 2,
      "itemsize": 4,
      "extent_np2": 65536,
      "old_cap": 4096,
      "new_cap": 2048,
      "old_rblock": 4096,
      "new_rblock": 2048,
      "emitted_rblock": 2048,
      "FLIP": true,
      "consistent": true,
      "num_warps": 32
    },
    {
      "kernel": "jsd",
      "M": 4096,
      "N": 98304,
      "split": "train",
      "n_tiled": 2,
      "nro": 2,
      "itemsize": 4,
      "extent_np2": 131072,
      "old_cap": 4096,
      "new_cap": 2048,
      "old_rblock": 4096,
      "new_rblock": 2048,
      "emitted_rblock": 2048,
      "FLIP": true,
      "consistent": true,
      "num_warps": 32
    },
    {
      "kernel": "jsd",
      "M": 8192,
      "N": 128256,
      "split": "train",
      "n_tiled": 2,
      "nro": 2,
      "itemsize": 4,
      "extent_np2": 131072,
      "old_cap": 4096,
      "new_cap": 2048,
      "old_rblock": 4096,
      "new_rblock": 2048,
      "emitted_rblock": 2048,
      "FLIP": true,
      "consistent": true,
      "num_warps": 32
    },
    {
      "kernel": "jsd",
      "M": 4096,
      "N": 128000,
      "split": "train",
      "n_tiled": 2,
      "nro": 2,
      "itemsize": 4,
      "extent_np2": 131072,
      "old_cap": 4096,
      "new_cap": 2048,
      "old_rblock": 4096,
      "new_rblock": 2048,
      "emitted_rblock": 2048,
      "FLIP": true,
      "consistent": true,
      "num_warps": 32
    },
    {
      "kernel": "jsd",
      "M": 4096,
      "N": 151936,
      "split": "train",
      "n_tiled": 2,
      "nro": 2,
      "itemsize": 4,
      "extent_np2": 262144,
      "old_cap": 4096,
      "new_cap": 2048,
      "old_rblock": 4096,
      "new_rblock": 2048,
      "emitted_rblock": 2048,
      "FLIP": true,
      "consistent": true,
      "num_warps": 32
    },
    {
      "kernel": "jsd",
      "M": 2048,
      "N": 256000,
      "split": "train",
      "n_tiled": 2,
      "nro": 2,
      "itemsize": 4,
      "extent_np2": 262144,
      "old_cap": 4096,
      "new_cap": 2048,
      "old_rblock": 4096,
      "new_rblock": 2048,
      "emitted_rblock": 2048,
      "FLIP": true,
      "consistent": true,
      "num_warps": 32
    },
    {
      "kernel": "jsd",
      "M": 16384,
      "N": 32000,
      "split": "train",
      "n_tiled": 2,
      "nro": 2,
      "itemsize": 4,
      "extent_np2": 32768,
      "old_cap": 4096,
      "new_cap": 2048,
      "old_rblock": 4096,
      "new_rblock": 2048,
      "emitted_rblock": 2048,
      "FLIP": true,
      "consistent": true,
      "num_warps": 32
    },
    {
      "kernel": "jsd",
      "M": 4096,
      "N": 32000,
      "split": "val",
      "n_tiled": 2,
      "nro": 2,
      "itemsize": 4,
      "extent_np2": 32768,
      "old_cap": 4096,
      "new_cap": 2048,
      "old_rblock": 4096,
      "new_rblock": 2048,
      "emitted_rblock": 2048,
      "FLIP": true,
      "consistent": true,
      "num_warps": 32
    },
    {
      "kernel": "jsd",
      "M": 8192,
      "N": 40960,
      "split": "val",
      "n_tiled": 2,
      "nro": 2,
      "itemsize": 4,
      "extent_np2": 65536,
      "old_cap": 4096,
      "new_cap": 2048,
      "old_rblock": 4096,
      "new_rblock": 2048,
      "emitted_rblock": 2048,
      "FLIP": true,
      "consistent": true,
      "num_warps": 32
    },
    {
      "kernel": "jsd",
      "M": 4096,
      "N": 50257,
      "split": "val",
      "n_tiled": 2,
      "nro": 2,
      "itemsize": 4,
      "extent_np2": 65536,
      "old_cap": 4096,
      "new_cap": 2048,
      "old_rblock": 4096,
      "new_rblock": 2048,
      "emitted_rblock": 2048,
      "FLIP": true,
      "consistent": true,
      "num_warps": 32
    },
    {
      "kernel": "jsd",
      "M": 2048,
      "N": 100352,
      "split": "val",
      "n_tiled": 2,
      "nro": 2,
      "itemsize": 4,
      "extent_np2": 131072,
      "old_cap": 4096,
      "new_cap": 2048,
      "old_rblock": 4096,
      "new_rblock": 2048,
      "emitted_rblock": 2048,
      "FLIP": true,
      "consistent": true,
      "num_warps": 32
    },
    {
      "kernel": "jsd",
      "M": 4096,
      "N": 128256,
      "split": "val",
      "n_tiled": 2,
      "nro": 2,
      "itemsize": 4,
      "extent_np2": 131072,
      "old_cap": 4096,
      "new_cap": 2048,
      "old_rblock": 4096,
      "new_rblock": 2048,
      "emitted_rblock": 2048,
      "FLIP": true,
      "consistent": true,
      "num_warps": 32
    },
    {
      "kernel": "jsd",
      "M": 2048,
      "N": 151936,
      "split": "val",
      "n_tiled": 2,
      "nro": 2,
      "itemsize": 4,
      "extent_np2": 262144,
      "old_cap": 4096,
      "new_cap": 2048,
      "old_rblock": 4096,
      "new_rblock": 2048,
      "emitted_rblock": 2048,
      "FLIP": true,
      "consistent": true,
      "num_warps": 32
    },
    {
      "kernel": "jsd",
      "M": 2048,
      "N": 200000,
      "split": "val",
      "n_tiled": 2,
      "nro": 2,
      "itemsize": 4,
      "extent_np2": 262144,
      "old_cap": 4096,
      "new_cap": 2048,
      "old_rblock": 4096,
      "new_rblock": 2048,
      "emitted_rblock": 2048,
      "FLIP": true,
      "consistent": true,
      "num_warps": 32
    },
    {
      "kernel": "jsd",
      "M": 8192,
      "N": 32768,
      "split": "test",
      "n_tiled": 2,
      "nro": 2,
      "itemsize": 4,
      "extent_np2": 32768,
      "old_cap": 4096,
      "new_cap": 2048,
      "old_rblock": 4096,
      "new_rblock": 2048,
      "emitted_rblock": 2048,
      "FLIP": true,
      "consistent": true,
      "num_warps": 32
    },
    {
      "kernel": "jsd",
      "M": 8192,
      "N": 49152,
      "split": "test",
      "n_tiled": 2,
      "nro": 2,
      "itemsize": 4,
      "extent_np2": 65536,
      "old_cap": 4096,
      "new_cap": 2048,
      "old_rblock": 4096,
      "new_rblock": 2048,
      "emitted_rblock": 2048,
      "FLIP": true,
      "consistent": true,
      "num_warps": 32
    },
    {
      "kernel": "jsd",
      "M": 2048,
      "N": 50257,
      "split": "test",
      "n_tiled": 2,
      "nro": 2,
      "itemsize": 4,
      "extent_np2": 65536,
      "old_cap": 4096,
      "new_cap": 2048,
      "old_rblock": 4096,
      "new_rblock": 2048,
      "emitted_rblock": 2048,
      "FLIP": true,
      "consistent": true,
      "num_warps": 32
    },
    {
      "kernel": "jsd",
      "M": 4096,
      "N": 114688,
      "split": "test",
      "n_tiled": 2,
      "nro": 2,
      "itemsize": 4,
      "extent_np2": 131072,
      "old_cap": 4096,
      "new_cap": 2048,
      "old_rblock": 4096,
      "new_rblock": 2048,
      "emitted_rblock": 2048,
      "FLIP": true,
      "consistent": true,
      "num_warps": 32
    },
    {
      "kernel": "jsd",
      "M": 2048,
      "N": 128256,
      "split": "test",
      "n_tiled": 2,
      "nro": 2,
      "itemsize": 4,
      "extent_np2": 131072,
      "old_cap": 4096,
      "new_cap": 2048,
      "old_rblock": 4096,
      "new_rblock": 2048,
      "emitted_rblock": 2048,
      "FLIP": true,
      "consistent": true,
      "num_warps": 32
    },
    {
      "kernel": "jsd",
      "M": 8192,
      "N": 151936,
      "split": "test",
      "n_tiled": 2,
      "nro": 2,
      "itemsize": 4,
      "extent_np2": 262144,
      "old_cap": 4096,
      "new_cap": 2048,
      "old_rblock": 4096,
      "new_rblock": 2048,
      "emitted_rblock": 2048,
      "FLIP": true,
      "consistent": true,
      "num_warps": 32
    },
    {
      "kernel": "jsd",
      "M": 1024,
      "N": 250000,
      "split": "test",
      "n_tiled": 2,
      "nro": 2,
      "itemsize": 4,
      "extent_np2": 262144,
      "old_cap": 4096,
      "new_cap": 2048,
      "old_rblock": 4096,
      "new_rblock": 2048,
      "emitted_rblock": 2048,
      "FLIP": true,
      "consistent": true,
      "num_warps": 32
    },
    {
      "kernel": "jsd",
      "M": 1,
      "N": 32000,
      "split": "robustness",
      "n_tiled": 2,
      "nro": 2,
      "itemsize": 4,
      "extent_np2": 32768,
      "old_cap": 4096,
      "new_cap": 2048,
      "old_rblock": 4096,
      "new_rblock": 2048,
      "emitted_rblock": 2048,
      "FLIP": true,
      "consistent": true,
      "num_warps": 32
    },
    {
      "kernel": "jsd",
      "M": 16,
      "N": 128256,
      "split": "robustness",
      "n_tiled": 2,
      "nro": 2,
      "itemsize": 4,
      "extent_np2": 131072,
      "old_cap": 4096,
      "new_cap": 2048,
      "old_rblock": 4096,
      "new_rblock": 2048,
      "emitted_rblock": 2048,
      "FLIP": true,
      "consistent": true,
      "num_warps": 32
    },
    {
      "kernel": "jsd",
      "M": 128,
      "N": 151936,
      "split": "robustness",
      "n_tiled": 2,
      "nro": 2,
      "itemsize": 4,
      "extent_np2": 262144,
      "old_cap": 4096,
      "new_cap": 2048,
      "old_rblock": 4096,
      "new_rblock": 2048,
      "emitted_rblock": 2048,
      "FLIP": true,
      "consistent": true,
      "num_warps": 32
    },
    {
      "kernel": "jsd",
      "M": 2048,
      "N": 32003,
      "split": "robustness",
      "n_tiled": 2,
      "nro": 2,
      "itemsize": 4,
      "extent_np2": 32768,
      "old_cap": 4096,
      "new_cap": 2048,
      "old_rblock": 4096,
      "new_rblock": 2048,
      "emitted_rblock": 2048,
      "FLIP": true,
      "consistent": true,
      "num_warps": 32
    },
    {
      "kernel": "jsd",
      "M": 2048,
      "N": 50261,
      "split": "robustness",
      "n_tiled": 2,
      "nro": 2,
      "itemsize": 4,
      "extent_np2": 65536,
      "old_cap": 4096,
      "new_cap": 2048,
      "old_rblock": 4096,
      "new_rblock": 2048,
      "emitted_rblock": 2048,
      "FLIP": true,
      "consistent": true,
      "num_warps": 32
    },
    {
      "kernel": "jsd",
      "M": 4,
      "N": 256000,
      "split": "robustness",
      "n_tiled": 2,
      "nro": 2,
      "itemsize": 4,
      "extent_np2": 262144,
      "old_cap": 4096,
      "new_cap": 2048,
      "old_rblock": 4096,
      "new_rblock": 2048,
      "emitted_rblock": 2048,
      "FLIP": true,
      "consistent": true,
      "num_warps": 32
    },
    {
      "kernel": "jsd",
      "M": 262144,
      "N": 4096,
      "split": "robustness",
      "n_tiled": 2,
      "nro": 2,
      "itemsize": 4,
      "extent_np2": 4096,
      "old_cap": 4096,
      "new_cap": 2048,
      "old_rblock": 4096,
      "new_rblock": 2048,
      "emitted_rblock": 2048,
      "FLIP": true,
      "consistent": true,
      "num_warps": 8
    },
    {
      "kernel": "jsd",
      "M": 8192,
      "N": 1024,
      "split": "robustness",
      "n_tiled": 2,
      "nro": 2,
      "itemsize": 4,
      "extent_np2": 1024,
      "old_cap": 4096,
      "new_cap": 2048,
      "old_rblock": 1024,
      "new_rblock": 1024,
      "emitted_rblock": 1024,
      "FLIP": false,
      "consistent": true,
      "num_warps": 4
    },
    {
      "kernel": "kl_div",
      "M": 8192,
      "N": 30522,
      "split": "train",
      "n_tiled": 2,
      "nro": 1,
      "itemsize": 4,
      "extent_np2": 32768,
      "old_cap": 4096,
      "new_cap": 4096,
      "old_rblock": 4096,
      "new_rblock": 4096,
      "emitted_rblock": 4096,
      "FLIP": false,
      "consistent": true,
      "num_warps": 32
    },
    {
      "kernel": "kl_div",
      "M": 8192,
      "N": 32000,
      "split": "train",
      "n_tiled": 2,
      "nro": 1,
      "itemsize": 4,
      "extent_np2": 32768,
      "old_cap": 4096,
      "new_cap": 4096,
      "old_rblock": 4096,
      "new_rblock": 4096,
      "emitted_rblock": 4096,
      "FLIP": false,
      "consistent": true,
      "num_warps": 32
    },
    {
      "kernel": "kl_div",
      "M": 4096,
      "N": 32064,
      "split": "train",
      "n_tiled": 2,
      "nro": 1,
      "itemsize": 4,
      "extent_np2": 32768,
      "old_cap": 4096,
      "new_cap": 4096,
      "old_rblock": 4096,
      "new_rblock": 4096,
      "emitted_rblock": 4096,
      "FLIP": false,
      "consistent": true,
      "num_warps": 32
    },
    {
      "kernel": "kl_div",
      "M": 8192,
      "N": 50257,
      "split": "train",
      "n_tiled": 2,
      "nro": 1,
      "itemsize": 4,
      "extent_np2": 65536,
      "old_cap": 4096,
      "new_cap": 4096,
      "old_rblock": 4096,
      "new_rblock": 4096,
      "emitted_rblock": 4096,
      "FLIP": false,
      "consistent": true,
      "num_warps": 32
    },
    {
      "kernel": "kl_div",
      "M": 4096,
      "N": 50304,
      "split": "train",
      "n_tiled": 2,
      "nro": 1,
      "itemsize": 4,
      "extent_np2": 65536,
      "old_cap": 4096,
      "new_cap": 4096,
      "old_rblock": 4096,
      "new_rblock": 4096,
      "emitted_rblock": 4096,
      "FLIP": false,
      "consistent": true,
      "num_warps": 32
    },
    {
      "kernel": "kl_div",
      "M": 4096,
      "N": 65536,
      "split": "train",
      "n_tiled": 2,
      "nro": 1,
      "itemsize": 4,
      "extent_np2": 65536,
      "old_cap": 4096,
      "new_cap": 4096,
      "old_rblock": 4096,
      "new_rblock": 4096,
      "emitted_rblock": 4096,
      "FLIP": false,
      "consistent": true,
      "num_warps": 32
    },
    {
      "kernel": "kl_div",
      "M": 4096,
      "N": 49152,
      "split": "train",
      "n_tiled": 2,
      "nro": 1,
      "itemsize": 4,
      "extent_np2": 65536,
      "old_cap": 4096,
      "new_cap": 4096,
      "old_rblock": 4096,
      "new_rblock": 4096,
      "emitted_rblock": 4096,
      "FLIP": false,
      "consistent": true,
      "num_warps": 32
    },
    {
      "kernel": "kl_div",
      "M": 2048,
      "N": 98304,
      "split": "train",
      "n_tiled": 2,
      "nro": 1,
      "itemsize": 4,
      "extent_np2": 131072,
      "old_cap": 4096,
      "new_cap": 4096,
      "old_rblock": 4096,
      "new_rblock": 4096,
      "emitted_rblock": 4096,
      "FLIP": false,
      "consistent": true,
      "num_warps": 32
    },
    {
      "kernel": "kl_div",
      "M": 4096,
      "N": 128256,
      "split": "train",
      "n_tiled": 2,
      "nro": 1,
      "itemsize": 4,
      "extent_np2": 131072,
      "old_cap": 4096,
      "new_cap": 4096,
      "old_rblock": 4096,
      "new_rblock": 4096,
      "emitted_rblock": 4096,
      "FLIP": false,
      "consistent": true,
      "num_warps": 32
    },
    {
      "kernel": "kl_div",
      "M": 2048,
      "N": 128000,
      "split": "train",
      "n_tiled": 2,
      "nro": 1,
      "itemsize": 4,
      "extent_np2": 131072,
      "old_cap": 4096,
      "new_cap": 4096,
      "old_rblock": 4096,
      "new_rblock": 4096,
      "emitted_rblock": 4096,
      "FLIP": false,
      "consistent": true,
      "num_warps": 32
    },
    {
      "kernel": "kl_div",
      "M": 2048,
      "N": 151936,
      "split": "train",
      "n_tiled": 2,
      "nro": 1,
      "itemsize": 4,
      "extent_np2": 262144,
      "old_cap": 4096,
      "new_cap": 4096,
      "old_rblock": 4096,
      "new_rblock": 4096,
      "emitted_rblock": 4096,
      "FLIP": false,
      "consistent": true,
      "num_warps": 32
    },
    {
      "kernel": "kl_div",
      "M": 1024,
      "N": 256000,
      "split": "train",
      "n_tiled": 2,
      "nro": 1,
      "itemsize": 4,
      "extent_np2": 262144,
      "old_cap": 4096,
      "new_cap": 4096,
      "old_rblock": 4096,
      "new_rblock": 4096,
      "emitted_rblock": 4096,
      "FLIP": false,
      "consistent": true,
      "num_warps": 32
    },
    {
      "kernel": "kl_div",
      "M": 16384,
      "N": 32000,
      "split": "train",
      "n_tiled": 2,
      "nro": 1,
      "itemsize": 4,
      "extent_np2": 32768,
      "old_cap": 4096,
      "new_cap": 4096,
      "old_rblock": 4096,
      "new_rblock": 4096,
      "emitted_rblock": 4096,
      "FLIP": false,
      "consistent": true,
      "num_warps": 32
    },
    {
      "kernel": "kl_div",
      "M": 4096,
      "N": 32000,
      "split": "val",
      "n_tiled": 2,
      "nro": 1,
      "itemsize": 4,
      "extent_np2": 32768,
      "old_cap": 4096,
      "new_cap": 4096,
      "old_rblock": 4096,
      "new_rblock": 4096,
      "emitted_rblock": 4096,
      "FLIP": false,
      "consistent": true,
      "num_warps": 32
    },
    {
      "kernel": "kl_div",
      "M": 8192,
      "N": 40960,
      "split": "val",
      "n_tiled": 2,
      "nro": 1,
      "itemsize": 4,
      "extent_np2": 65536,
      "old_cap": 4096,
      "new_cap": 4096,
      "old_rblock": 4096,
      "new_rblock": 4096,
      "emitted_rblock": 4096,
      "FLIP": false,
      "consistent": true,
      "num_warps": 32
    },
    {
      "kernel": "kl_div",
      "M": 4096,
      "N": 50257,
      "split": "val",
      "n_tiled": 2,
      "nro": 1,
      "itemsize": 4,
      "extent_np2": 65536,
      "old_cap": 4096,
      "new_cap": 4096,
      "old_rblock": 4096,
      "new_rblock": 4096,
      "emitted_rblock": 4096,
      "FLIP": false,
      "consistent": true,
      "num_warps": 32
    },
    {
      "kernel": "kl_div",
      "M": 2048,
      "N": 100352,
      "split": "val",
      "n_tiled": 2,
      "nro": 1,
      "itemsize": 4,
      "extent_np2": 131072,
      "old_cap": 4096,
      "new_cap": 4096,
      "old_rblock": 4096,
      "new_rblock": 4096,
      "emitted_rblock": 4096,
      "FLIP": false,
      "consistent": true,
      "num_warps": 32
    },
    {
      "kernel": "kl_div",
      "M": 2048,
      "N": 128256,
      "split": "val",
      "n_tiled": 2,
      "nro": 1,
      "itemsize": 4,
      "extent_np2": 131072,
      "old_cap": 4096,
      "new_cap": 4096,
      "old_rblock": 4096,
      "new_rblock": 4096,
      "emitted_rblock": 4096,
      "FLIP": false,
      "consistent": true,
      "num_warps": 32
    },
    {
      "kernel": "kl_div",
      "M": 1024,
      "N": 151936,
      "split": "val",
      "n_tiled": 2,
      "nro": 1,
      "itemsize": 4,
      "extent_np2": 262144,
      "old_cap": 4096,
      "new_cap": 4096,
      "old_rblock": 4096,
      "new_rblock": 4096,
      "emitted_rblock": 4096,
      "FLIP": false,
      "consistent": true,
      "num_warps": 32
    },
    {
      "kernel": "kl_div",
      "M": 2048,
      "N": 200000,
      "split": "val",
      "n_tiled": 2,
      "nro": 1,
      "itemsize": 4,
      "extent_np2": 262144,
      "old_cap": 4096,
      "new_cap": 4096,
      "old_rblock": 4096,
      "new_rblock": 4096,
      "emitted_rblock": 4096,
      "FLIP": false,
      "consistent": true,
      "num_warps": 32
    },
    {
      "kernel": "kl_div",
      "M": 8192,
      "N": 32768,
      "split": "test",
      "n_tiled": 2,
      "nro": 1,
      "itemsize": 4,
      "extent_np2": 32768,
      "old_cap": 4096,
      "new_cap": 4096,
      "old_rblock": 4096,
      "new_rblock": 4096,
      "emitted_rblock": 4096,
      "FLIP": false,
      "consistent": true,
      "num_warps": 32
    },
    {
      "kernel": "kl_div",
      "M": 8192,
      "N": 49152,
      "split": "test",
      "n_tiled": 2,
      "nro": 1,
      "itemsize": 4,
      "extent_np2": 65536,
      "old_cap": 4096,
      "new_cap": 4096,
      "old_rblock": 4096,
      "new_rblock": 4096,
      "emitted_rblock": 4096,
      "FLIP": false,
      "consistent": true,
      "num_warps": 32
    },
    {
      "kernel": "kl_div",
      "M": 2048,
      "N": 50257,
      "split": "test",
      "n_tiled": 2,
      "nro": 1,
      "itemsize": 4,
      "extent_np2": 65536,
      "old_cap": 4096,
      "new_cap": 4096,
      "old_rblock": 4096,
      "new_rblock": 4096,
      "emitted_rblock": 4096,
      "FLIP": false,
      "consistent": true,
      "num_warps": 32
    },
    {
      "kernel": "kl_div",
      "M": 4096,
      "N": 114688,
      "split": "test",
      "n_tiled": 2,
      "nro": 1,
      "itemsize": 4,
      "extent_np2": 131072,
      "old_cap": 4096,
      "new_cap": 4096,
      "old_rblock": 4096,
      "new_rblock": 4096,
      "emitted_rblock": 4096,
      "FLIP": false,
      "consistent": true,
      "num_warps": 32
    },
    {
      "kernel": "kl_div",
      "M": 1024,
      "N": 128256,
      "split": "test",
      "n_tiled": 2,
      "nro": 1,
      "itemsize": 4,
      "extent_np2": 131072,
      "old_cap": 4096,
      "new_cap": 4096,
      "old_rblock": 4096,
      "new_rblock": 4096,
      "emitted_rblock": 4096,
      "FLIP": false,
      "consistent": true,
      "num_warps": 32
    },
    {
      "kernel": "kl_div",
      "M": 4096,
      "N": 151936,
      "split": "test",
      "n_tiled": 2,
      "nro": 1,
      "itemsize": 4,
      "extent_np2": 262144,
      "old_cap": 4096,
      "new_cap": 4096,
      "old_rblock": 4096,
      "new_rblock": 4096,
      "emitted_rblock": 4096,
      "FLIP": false,
      "consistent": true,
      "num_warps": 32
    },
    {
      "kernel": "kl_div",
      "M": 1024,
      "N": 250000,
      "split": "test",
      "n_tiled": 2,
      "nro": 1,
      "itemsize": 4,
      "extent_np2": 262144,
      "old_cap": 4096,
      "new_cap": 4096,
      "old_rblock": 4096,
      "new_rblock": 4096,
      "emitted_rblock": 4096,
      "FLIP": false,
      "consistent": true,
      "num_warps": 32
    },
    {
      "kernel": "kl_div",
      "M": 1,
      "N": 32000,
      "split": "robustness",
      "n_tiled": 2,
      "nro": 1,
      "itemsize": 4,
      "extent_np2": 32768,
      "old_cap": 4096,
      "new_cap": 4096,
      "old_rblock": 4096,
      "new_rblock": 4096,
      "emitted_rblock": 4096,
      "FLIP": false,
      "consistent": true,
      "num_warps": 32
    },
    {
      "kernel": "kl_div",
      "M": 16,
      "N": 128256,
      "split": "robustness",
      "n_tiled": 2,
      "nro": 1,
      "itemsize": 4,
      "extent_np2": 131072,
      "old_cap": 4096,
      "new_cap": 4096,
      "old_rblock": 4096,
      "new_rblock": 4096,
      "emitted_rblock": 4096,
      "FLIP": false,
      "consistent": true,
      "num_warps": 32
    },
    {
      "kernel": "kl_div",
      "M": 128,
      "N": 151936,
      "split": "robustness",
      "n_tiled": 2,
      "nro": 1,
      "itemsize": 4,
      "extent_np2": 262144,
      "old_cap": 4096,
      "new_cap": 4096,
      "old_rblock": 4096,
      "new_rblock": 4096,
      "emitted_rblock": 4096,
      "FLIP": false,
      "consistent": true,
      "num_warps": 32
    },
    {
      "kernel": "kl_div",
      "M": 2048,
      "N": 32003,
      "split": "robustness",
      "n_tiled": 2,
      "nro": 1,
      "itemsize": 4,
      "extent_np2": 32768,
      "old_cap": 4096,
      "new_cap": 4096,
      "old_rblock": 4096,
      "new_rblock": 4096,
      "emitted_rblock": 4096,
      "FLIP": false,
      "consistent": true,
      "num_warps": 32
    },
    {
      "kernel": "kl_div",
      "M": 2048,
      "N": 50261,
      "split": "robustness",
      "n_tiled": 2,
      "nro": 1,
      "itemsize": 4,
      "extent_np2": 65536,
      "old_cap": 4096,
      "new_cap": 4096,
      "old_rblock": 4096,
      "new_rblock": 4096,
      "emitted_rblock": 4096,
      "FLIP": false,
      "consistent": true,
      "num_warps": 32
    },
    {
      "kernel": "kl_div",
      "M": 4,
      "N": 256000,
      "split": "robustness",
      "n_tiled": 2,
      "nro": 1,
      "itemsize": 4,
      "extent_np2": 262144,
      "old_cap": 4096,
      "new_cap": 4096,
      "old_rblock": 4096,
      "new_rblock": 4096,
      "emitted_rblock": 4096,
      "FLIP": false,
      "consistent": true,
      "num_warps": 32
    },
    {
      "kernel": "kl_div",
      "M": 262144,
      "N": 4096,
      "split": "robustness",
      "n_tiled": 2,
      "nro": 1,
      "itemsize": 4,
      "extent_np2": 4096,
      "old_cap": 4096,
      "new_cap": 4096,
      "old_rblock": 4096,
      "new_rblock": 4096,
      "emitted_rblock": 4096,
      "FLIP": false,
      "consistent": true,
      "num_warps": 8
    },
    {
      "kernel": "kl_div",
      "M": 8192,
      "N": 1024,
      "split": "robustness",
      "n_tiled": 2,
      "nro": 1,
      "itemsize": 4,
      "extent_np2": 1024,
      "old_cap": 4096,
      "new_cap": 4096,
      "old_rblock": 1024,
      "new_rblock": 1024,
      "emitted_rblock": 1024,
      "FLIP": false,
      "consistent": true,
      "num_warps": 4
    },
    {
      "kernel": "sum",
      "M": 16384,
      "N": 1024,
      "split": "train",
      "n_tiled": 0,
      "nro": 1,
      "itemsize": 4,
      "extent_np2": 1024,
      "old_cap": 4096,
      "new_cap": 4096,
      "old_rblock": null,
      "new_rblock": null,
      "emitted_rblock": null,
      "FLIP": false,
      "consistent": true,
      "num_warps": 4
    },
    {
      "kernel": "sum",
      "M": 16384,
      "N": 2048,
      "split": "train",
      "n_tiled": 0,
      "nro": 1,
      "itemsize": 4,
      "extent_np2": 2048,
      "old_cap": 4096,
      "new_cap": 4096,
      "old_rblock": null,
      "new_rblock": null,
      "emitted_rblock": null,
      "FLIP": false,
      "consistent": true,
      "num_warps": 8
    },
    {
      "kernel": "sum",
      "M": 16384,
      "N": 2560,
      "split": "train",
      "n_tiled": 0,
      "nro": 1,
      "itemsize": 4,
      "extent_np2": 4096,
      "old_cap": 4096,
      "new_cap": 4096,
      "old_rblock": null,
      "new_rblock": null,
      "emitted_rblock": null,
      "FLIP": false,
      "consistent": true,
      "num_warps": 8
    },
    {
      "kernel": "softmax",
      "M": 262144,
      "N": 128,
      "split": "train",
      "n_tiled": 0,
      "nro": 2,
      "itemsize": 4,
      "extent_np2": 128,
      "old_cap": 4096,
      "new_cap": 2048,
      "old_rblock": 128,
      "new_rblock": 128,
      "emitted_rblock": 128,
      "FLIP": false,
      "consistent": true,
      "num_warps": 4
    },
    {
      "kernel": "softmax",
      "M": 131072,
      "N": 256,
      "split": "train",
      "n_tiled": 0,
      "nro": 2,
      "itemsize": 4,
      "extent_np2": 256,
      "old_cap": 4096,
      "new_cap": 2048,
      "old_rblock": 256,
      "new_rblock": 256,
      "emitted_rblock": 256,
      "FLIP": false,
      "consistent": true,
      "num_warps": 4
    },
    {
      "kernel": "softmax",
      "M": 16384,
      "N": 512,
      "split": "train",
      "n_tiled": 0,
      "nro": 2,
      "itemsize": 4,
      "extent_np2": 512,
      "old_cap": 4096,
      "new_cap": 2048,
      "old_rblock": 512,
      "new_rblock": 512,
      "emitted_rblock": 512,
      "FLIP": false,
      "consistent": true,
      "num_warps": 4
    }
  ],
  "n_flip": 34,
  "n_ident": 42,
  "flips": [
    "jsd(8192,30522)[train]",
    "jsd(8192,32000)[train]",
    "jsd(8192,32064)[train]",
    "jsd(8192,50257)[train]",
    "jsd(8192,50304)[train]",
    "jsd(8192,65536)[train]",
    "jsd(4096,49152)[train]",
    "jsd(4096,98304)[train]",
    "jsd(8192,128256)[train]",
    "jsd(4096,128000)[train]",
    "jsd(4096,151936)[train]",
    "jsd(2048,256000)[train]",
    "jsd(16384,32000)[train]",
    "jsd(4096,32000)[val]",
    "jsd(8192,40960)[val]",
    "jsd(4096,50257)[val]",
    "jsd(2048,100352)[val]",
    "jsd(4096,128256)[val]",
    "jsd(2048,151936)[val]",
    "jsd(2048,200000)[val]",
    "jsd(8192,32768)[test]",
    "jsd(8192,49152)[test]",
    "jsd(2048,50257)[test]",
    "jsd(4096,114688)[test]",
    "jsd(2048,128256)[test]",
    "jsd(8192,151936)[test]",
    "jsd(1024,250000)[test]",
    "jsd(1,32000)[robustness]",
    "jsd(16,128256)[robustness]",
    "jsd(128,151936)[robustness]",
    "jsd(2048,32003)[robustness]",
    "jsd(2048,50261)[robustness]",
    "jsd(4,256000)[robustness]",
    "jsd(262144,4096)[robustness]"
  ]
}